title,month,year,budget,Domestic Gross($M),Worldwide Gross($M),length,budget,rating,votes,mpaa,action,animation,comedy,drama,documentary,romance,short,bechdel,Year,Rated,Released,Runtime,Genre,Director,Writer,Actors,Language,Country,Awards,Metascore,imdbRating,imdbVotes,imdbID,lame,label
Man on Fire,Apr,2004,60.0,77.906816,130.968579,146,70000000.0,7.4,14358,R,1,0,0,1,0,0,0,,2004,R,23 Apr 2004,146 min,"Action, Crime, Drama",Tony Scott,"A.J. Quinnell (novel), Brian Helgeland (screenplay)","Denzel Washington, Dakota Fanning, Radha Mitchell, Christopher Walken","English, Spanish","USA, UK",1 win & 7 nominations.,47.0,7.7,"269,047",tt0328107,1,0
Mean Girls,Apr,2004,18.0,86.047227,130.953026,97,17000000.0,7.0,11591,PG-13,0,0,1,1,0,0,0,PASS,2004,PG-13,30 Apr 2004,97 min,Comedy,Mark Waters,"Rosalind Wiseman (book), Tina Fey (screenplay)","Lindsay Lohan, Rachel McAdams, Tina Fey, Tim Meadows","English, German, Vietnamese, Swahili","USA, Canada",7 wins & 23 nominations.,66.0,7.0,"250,156",tt0377092,1,0
About a Boy,May,2002,27.0,40.803000000000004,130.759651,101,27000000.0,7.5,18318,PG-13,0,0,1,1,0,0,0,,2002,PG-13,17 May 2002,101 min,"Comedy, Drama, Romance","Chris Weitz, Paul Weitz","Nick Hornby (novel), Peter Hedges (screenplay), Chris Weitz (screenplay), Paul Weitz (screenplay)","Hugh Grant, Nicholas Hoult, Sharon Small, Madison Cook",English,"UK, USA, France, Germany",Nominated for 1 Oscar. Another 11 wins & 28 nominations.,75.0,7.1,"145,281",tt0276751,1,0
Jingle All the Way,Nov,1996,60.0,60.592389000000004,129.83238899999998,88,60000000.0,4.7,6246,PG,1,0,1,0,0,0,0,FAIL,1996,PG,22 Nov 1996,89 min,"Comedy, Family",Brian Levant,Randy Kornfield,"Arnold Schwarzenegger, Sinbad, Phil Hartman, Rita Wilson",English,USA,2 wins & 3 nominations.,,5.5,"69,017",tt0116705,1,0
Space Cowboys,Aug,2000,65.0,90.454043,128.874043,130,65000000.0,6.4,11887,,0,0,0,1,0,0,0,,2000,PG-13,04 Aug 2000,130 min,"Action, Adventure, Thriller",Clint Eastwood,"Ken Kaufman, Howard Klausner","Clint Eastwood, Tommy Lee Jones, Donald Sutherland, James Garner",English,USA,Nominated for 1 Oscar. Another 4 wins & 6 nominations.,73.0,6.4,"60,835",tt0186566,1,0
U-571,Apr,2000,62.0,77.08603000000001,127.63003,116,62000000.0,6.5,15792,PG-13,1,0,0,1,0,0,0,,2000,PG-13,21 Apr 2000,116 min,"Action, War",Jonathan Mostow,"Jonathan Mostow (story), Jonathan Mostow (screenplay), Sam Montgomery (screenplay), David Ayer (screenplay)","Matthew McConaughey, Bill Paxton, Harvey Keitel, Jon Bon Jovi","English, German","France, USA",Won 1 Oscar. Another 3 wins & 10 nominations.,62.0,6.6,"65,822",tt0141926,1,0
First Knight,Jul,1995,75.0,37.361412,127.36141200000002,134,75000000.0,5.6,8708,PG-13,0,0,0,1,0,1,0,,1995,PG-13,07 Jul 1995,134 min,"Action, Adventure, Romance",Jerry Zucker,"Lorne Cameron (story), David Hoselton (story), William Nicholson (story), William Nicholson (screenplay)","Sean Connery, Richard Gere, Julia Ormond, Ben Cross",English,"USA, UK",,,5.9,"55,976",tt0113071,1,0
American Wedding,Aug,2003,55.0,104.35420500000001,126.42511499999999,103,55000000.0,6.3,13590,R,0,0,1,0,0,0,0,,2003,R,01 Aug 2003,96 min,"Comedy, Romance",Jesse Dylan,"Adam Herz (characters), Adam Herz","Jason Biggs, Seann William Scott, Alyson Hannigan, Eddie Kaye Thomas",English,"USA, Germany",3 wins & 6 nominations.,43.0,6.3,"162,953",tt0328828,1,0
L.A. Confidential,Sep,1997,35.0,64.604977,126.204977,138,35000000.0,8.4,69600,,0,0,0,1,0,0,0,FAIL,1997,R,19 Sep 1997,138 min,"Crime, Drama, Mystery",Curtis Hanson,"James Ellroy (novel), Brian Helgeland (screenplay), Curtis Hanson (screenplay)","Kevin Spacey, Russell Crowe, Guy Pearce, James Cromwell",English,USA,Won 2 Oscars. Another 84 wins & 77 nominations.,90.0,8.3,"419,413",tt0119488,1,0
"Legally Blonde 2: Red, White & Blonde",Jul,2003,25.0,90.639088,125.33908799999999,95,45000000.0,4.4,6293,PG-13,0,0,1,0,0,0,0,PASS,2003,PG-13,02 Jul 2003,95 min,Comedy,Charles Herman-Wurmfeld,"Amanda Brown (characters), Eve Ahlert (story), Dennis Drake (story), Kate Kondell (story), Kate Kondell (screenplay)","Reese Witherspoon, Sally Field, Regina King, Jennifer Coolidge",English,USA,3 wins & 3 nominations.,47.0,4.6,"47,206",tt0333780,1,0
I Know What You Did Last Summer,Oct,1997,17.0,72.250091,125.250091,99,17000000.0,5.3,15932,R,0,0,0,0,0,0,0,PASS,1997,R,17 Oct 1997,101 min,"Horror, Mystery, Thriller",Jim Gillespie,"Lois Duncan (novel), Kevin Williamson (screenplay)","Jennifer Love Hewitt, Sarah Michelle Gellar, Ryan Phillippe, Freddie Prinze Jr.",English,USA,3 wins & 7 nominations.,52.0,5.6,"107,077",tt0119345,1,0
First Blood,Oct,1982,14.0,47.212903999999995,125.21290400000001,97,14000000.0,6.8,11956,,1,0,0,1,0,0,0,FAIL,1982,R,22 Oct 1982,93 min,"Action, Adventure, Drama",Ted Kotcheff,"David Morrell (novel), Michael Kozoll (screenplay), William Sackheim (screenplay), Sylvester Stallone (screenplay)","Sylvester Stallone, Richard Crenna, Brian Dennehy, Bill McKinney",English,USA,1 win & 2 nominations.,62.0,7.7,"174,108",tt0083944,1,0
Goldfinger,Dec,1964,3.0,51.1,124.9,112,3000000.0,7.8,19754,,1,0,0,0,0,0,0,,1964,APPROVED,09 Jan 1965,110 min,"Action, Adventure, Thriller",Guy Hamilton,"Richard Maibaum (screenplay), Paul Dehn (screenplay)","Sean Connery, Honor Blackman, Gert Fröbe, Shirley Eaton","English, Chinese, Spanish",UK,Won 1 Oscar. Another 3 wins & 6 nominations.,,7.8,"140,871",tt0058150,1,0
The Family Man,Dec,2000,60.0,75.764085,124.71586299999998,125,60000000.0,6.5,11220,PG-13,0,0,1,1,0,1,0,,2000,PG-13,22 Dec 2000,125 min,"Comedy, Drama, Fantasy",Brett Ratner,"David Diamond, David Weissman","Nicolas Cage, Téa Leoni, Don Cheadle, Jeremy Piven","English, Italian",USA,4 wins & 6 nominations.,42.0,6.7,"86,573",tt0218967,1,0
The Thomas Crown Affair,Aug,1999,48.0,69.304264,124.30426399999999,113,48000000.0,6.7,17220,R,0,0,1,0,0,1,0,,1999,R,06 Aug 1999,113 min,"Crime, Romance, Thriller",John McTiernan,"Alan Trustman (story), Leslie Dixon (screenplay), Kurt Wimmer (screenplay)","Pierce Brosnan, Rene Russo, Denis Leary, Ben Gazzara","English, German, Polish, French",USA,3 wins & 2 nominations.,72.0,6.8,"73,705",tt0155267,1,0
Big Fish,Dec,2003,70.0,66.432867,123.954323,125,70000000.0,8.1,31525,PG-13,0,0,1,1,0,0,0,FAIL,2003,PG-13,09 Jan 2004,125 min,"Adventure, Drama, Fantasy",Tim Burton,"Daniel Wallace (novel), John August (screenplay)","Ewan McGregor, Albert Finney, Billy Crudup, Jessica Lange","English, Cantonese",USA,Nominated for 1 Oscar. Another 1 win & 62 nominations.,58.0,8.0,"351,998",tt0319061,1,0
Hide and Seek,Jan,2005,25.0,51.100486,123.69674099999999,101,30000000.0,5.2,3784,R,0,0,0,1,0,0,0,PASS,2005,R,28 Jan 2005,101 min,"Drama, Horror, Mystery",John Polson,Ari Schlossberg,"Robert De Niro, Dakota Fanning, Famke Janssen, Elisabeth Shue",English,"USA, Germany",1 win & 5 nominations.,35.0,5.9,"70,506",tt0382077,1,0
Save the Last Dance,Jan,2001,13.0,91.038276,122.24432900000001,112,13000000.0,6.1,7613,PG-13,0,0,0,1,0,1,0,PASS,2001,PG-13,12 Jan 2001,112 min,"Drama, Music, Romance",Thomas Carter,"Duane Adler (story), Duane Adler (screenplay), Cheryl Edwards (screenplay)","Julia Stiles, Sean Patrick Thomas, Kerry Washington, Fredro Starr",English,USA,6 wins & 7 nominations.,53.0,6.2,"48,282",tt0206275,1,0
Mortal Kombat,Aug,1995,20.0,70.433227,122.133227,101,20000000.0,5.0,8779,PG-13,1,0,0,0,0,0,0,FAIL,1995,PG-13,18 Aug 1995,101 min,"Action, Adventure, Fantasy",Paul W.S. Anderson,"Ed Boon (video games), John Tobias (video games), Kevin Droney","Christopher Lambert, Robin Shou, Linden Ashby, Cary-Hiroyuki Tagawa",English,USA,1 win & 3 nominations.,58.0,5.8,"82,703",tt0113855,1,0
Executive Decision,Mar,1996,55.0,56.67919200000001,122.07919199999999,134,55000000.0,6.3,7653,,1,0,0,0,0,0,0,,1996,R,15 Mar 1996,133 min,"Action, Adventure, Thriller",Stuart Baird,"Jim Thomas, John Thomas","Kurt Russell, Steven Seagal, Halle Berry, John Leguizamo",English,USA,2 wins & 2 nominations.,,6.4,"41,304",tt0116253,1,0
The Princess Diaries 2: Royal Engagement,Aug,2004,45.0,95.149435,122.07143500000001,115,40000000.0,5.3,2605,,0,0,1,0,0,1,0,PASS,2004,G,11 Aug 2004,113 min,"Comedy, Family, Romance",Garry Marshall,"Meg Cabot (characters), Gina Wendkos (story), Shonda Rhimes (story), Shonda Rhimes (screenplay)","Anne Hathaway, Julie Andrews, Hector Elizondo, John Rhys-Davies","English, Greek, French, Spanish",USA,1 win & 2 nominations.,43.0,5.7,"54,734",tt0368933,1,0
Poltergeist,Jun,1982,10.7,74.706019,121.706019,114,10700000.0,7.3,11575,,0,0,0,0,0,0,0,PASS,1982,PG,04 Jun 1982,114 min,"Fantasy, Horror",Tobe Hooper,"Steven Spielberg (screenplay), Michael Grais (screenplay), Mark Victor (screenplay), Steven Spielberg (story)","Craig T. Nelson, JoBeth Williams, Beatrice Straight, Dominique Dunne",English,USA,Nominated for 3 Oscars. Another 4 wins & 4 nominations.,79.0,7.4,"108,271",tt0084516,1,0
Sahara,Apr,2005,145.0,68.671925,121.671925,124,130000000.0,5.8,3004,PG-13,1,0,1,0,0,0,0,,2005,PG-13,08 Apr 2005,124 min,"Action, Adventure, Comedy",Breck Eisner,"Clive Cussler (novel), Thomas Dean Donnelly (screenplay), Joshua Oppenheimer (screenplay), John C. Richards (screenplay), James V. Hart (screenplay)","Matthew McConaughey, Steve Zahn, Penélope Cruz, William H. Macy","English, French, Arabic","UK, Spain, Germany, USA",2 wins & 5 nominations.,41.0,6.0,"78,212",tt0318649,1,0
Intolerable Cruelty,Oct,2003,60.0,35.327628000000004,121.327628,100,60000000.0,6.6,11967,PG-13,0,0,1,0,0,1,0,,2003,PG-13,10 Oct 2003,100 min,"Comedy, Crime, Romance","Joel Coen, Ethan Coen","Robert Ramsey (story), Matthew Stone (story), John Romano (story), Robert Ramsey (screenplay), Matthew Stone (screenplay), Ethan Coen (screenplay), Joel Coen (screenplay)","George Clooney, Catherine Zeta-Jones, Geoffrey Rush, Cedric the Entertainer","English, French",USA,3 nominations.,71.0,6.3,"77,089",tt0138524,1,0
Starship Troopers,Nov,1997,100.0,54.768952,121.1,129,95000000.0,6.7,32618,R,1,0,0,0,0,0,0,PASS,1997,R,07 Nov 1997,129 min,"Action, Sci-Fi",Paul Verhoeven,"Edward Neumeier (screenplay), Robert A. Heinlein (book)","Casper Van Dien, Dina Meyer, Denise Richards, Jake Busey",English,USA,Nominated for 1 Oscar. Another 2 wins & 14 nominations.,51.0,7.2,"223,638",tt0120201,1,0
Lethal Weapon,Mar,1987,15.0,65.19235,120.19235,117,15000000.0,7.5,20041,,1,0,1,0,0,0,0,FAIL,1987,R,06 Mar 1987,110 min,"Action, Crime, Thriller",Richard Donner,Shane Black,"Mel Gibson, Danny Glover, Gary Busey, Mitchell Ryan",English,USA,Nominated for 1 Oscar. Another 5 wins & 1 nomination.,67.0,7.6,"193,334",tt0093409,1,0
Volcano,Apr,1997,90.0,47.546796,120.1,104,90000000.0,5.2,8627,PG-13,1,0,0,1,0,0,0,PASS,1997,PG-13,25 Apr 1997,104 min,"Action, Drama, Sci-Fi",Mick Jackson,"Jerome Armstrong (story), Jerome Armstrong (screenplay), Billy Ray (screenplay)","Tommy Lee Jones, Anne Heche, Gaby Hoffmann, Don Cheadle","English, Spanish, German",USA,1 win & 1 nomination.,55.0,5.4,"58,755",tt0120461,1,0
Star Trek: Generations,Nov,1994,38.0,75.671262,120.0,118,35000000.0,6.2,12651,,1,0,0,1,0,0,0,,1994,PG,18 Nov 1994,118 min,"Action, Adventure, Mystery",David Carson,"Gene Roddenberry (television series Star Trek), Rick Berman (story), Ronald D. Moore (story), Brannon Braga (story), Ronald D. Moore (screenplay), Brannon Braga (screenplay)","Patrick Stewart, Jonathan Frakes, Brent Spiner, LeVar Burton","English, Klingon",USA,2 wins & 4 nominations.,55.0,6.6,"61,621",tt0111280,1,0
Road Trip,May,2000,16.0,68.525609,119.73911000000001,94,15600000.0,6.3,15981,R,0,0,1,0,0,0,0,,2000,R,19 May 2000,93 min,"Adventure, Comedy",Todd Phillips,"Todd Phillips, Scot Armstrong","Breckin Meyer, Seann William Scott, Amy Smart, Paulo Costanzo",English,USA,3 wins & 9 nominations.,55.0,6.5,"134,216",tt0215129,1,0
Blazing Saddles,Feb,1974,2.6,119.5,119.5,93,2600000.0,7.7,17166,,0,0,1,0,0,0,0,FAIL,1974,R,07 Feb 1974,93 min,"Comedy, Western",Mel Brooks,"Mel Brooks (screenplay), Norman Steinberg (screenplay), Andrew Bergman (screenplay), Richard Pryor (screenplay), Alan Uger (screenplay), Andrew Bergman (story)","Cleavon Little, Gene Wilder, Slim Pickens, Harvey Korman","English, Yiddish, German",USA,Nominated for 3 Oscars. Another 3 wins & 2 nominations.,,7.8,"98,115",tt0071230,1,0
Star Trek: Insurrection,Dec,1998,70.0,70.187658,117.8,103,58000000.0,6.3,13395,PG,1,0,0,1,0,1,0,PASS,1998,PG,11 Dec 1998,103 min,"Action, Adventure, Sci-Fi",Jonathan Frakes,"Gene Roddenberry (creator: ""Star Trek""), Rick Berman (story), Michael Piller (story), Michael Piller (screenplay)","Patrick Stewart, Jonathan Frakes, Brent Spiner, LeVar Burton",English,USA,3 wins & 8 nominations.,64.0,6.4,"57,524",tt0120844,1,0
The Client,Jul,1994,45.0,92.115211,117.61521100000002,119,,6.4,8340,,0,0,0,1,0,0,0,PASS,1994,PG-13,20 Jul 1994,119 min,"Crime, Drama, Mystery",Joel Schumacher,"John Grisham (novel), Akiva Goldsman (screenplay), Robert Getchell (screenplay)","Susan Sarandon, Tommy Lee Jones, Mary-Louise Parker, Anthony LaPaglia",English,USA,Nominated for 1 Oscar. Another 3 wins & 3 nominations.,65.0,6.7,"46,232",tt0109446,1,0
Blue Streak,Sep,1999,36.0,68.20819,117.44815700000001,93,36000000.0,5.8,7952,,1,0,1,0,0,0,0,FAIL,1999,PG-13,17 Sep 1999,93 min,"Action, Comedy, Crime",Les Mayfield,"Michael Berry, John Blumenthal, Stephen Carpenter","Martin Lawrence, Luke Wilson, Peter Greene, Dave Chappelle","English, Spanish","USA, Germany",,46.0,6.3,"61,076",tt0181316,1,0
Lost in Translation,Sep,2003,4.0,44.585453,117.085297,102,4000000.0,8.0,42450,R,0,0,1,1,0,0,0,,2003,R,03 Oct 2003,101 min,Drama,Sofia Coppola,Sofia Coppola,"Scarlett Johansson, Bill Murray, Akiko Takeshita, Kazuyoshi Minamimagoe","English, Japanese, German, French","USA, Japan",Won 1 Oscar. Another 93 wins & 118 nominations.,89.0,7.8,"325,721",tt0335266,1,0
Snow Dogs,Jan,2002,32.0,81.150692,116.898028,99,35000000.0,5.1,2379,PG,0,0,1,0,0,0,0,FAIL,2002,PG,18 Jan 2002,99 min,"Adventure, Comedy, Family",Brian Levant,"Jim Kouf (screenplay), Tommy Swerdlow (screenplay), Michael Goldberg (screenplay), Mark Gibson (screenplay), Philip Halprin (screenplay), Gary Paulsen (book)","Cuba Gooding Jr., James Coburn, Sisqó, Nichelle Nichols",English,"Canada, USA",1 win.,29.0,5.1,"20,322",tt0281373,1,0
The Siege,Nov,1998,70.0,40.934175,116.625798,116,70000000.0,5.9,9725,R,1,0,0,1,0,0,0,,1998,R,06 Nov 1998,116 min,"Action, Thriller",Edward Zwick,"Lawrence Wright (story), Lawrence Wright (screenplay), Menno Meyjes (screenplay), Edward Zwick (screenplay)","Denzel Washington, Annette Bening, Bruce Willis, Tony Shalhoub","English, Arabic, Spanish",USA,2 wins & 4 nominations.,53.0,6.3,"58,482",tt0133952,1,0
The Notebook,Jun,2004,30.0,81.001787,116.025023,123,30000000.0,7.8,8830,PG-13,0,0,0,1,0,1,0,FAIL,2004,PG-13,25 Jun 2004,123 min,"Drama, Romance",Nick Cassavetes,"Jeremy Leven (screenplay), Jan Sardi (adaptation), Nicholas Sparks (novel)","Tim Ivey, Gena Rowlands, Starletta DuPois, James Garner",English,USA,12 wins & 9 nominations.,53.0,7.9,"403,475",tt0332280,1,0
Diamonds Are Forever,Dec,1971,7.2,43.8,116.0,120,7200000.0,6.6,8738,,1,0,0,0,0,0,0,,1971,GP,17 Dec 1971,120 min,"Action, Adventure, Thriller",Guy Hamilton,"Richard Maibaum (screenplay), Tom Mankiewicz (screenplay)","Sean Connery, Jill St. John, Charles Gray, Lana Wood","English, German","UK, USA",Nominated for 1 Oscar. Another 1 win & 3 nominations.,,6.7,"74,970",tt0066995,1,0
Finding Neverland,Nov,2004,25.0,51.676606,115.03610800000001,106,,8.1,17715,PG,0,0,0,1,0,0,0,PASS,2004,PG,17 Dec 2004,106 min,"Biography, Drama, Family",Marc Forster,"Allan Knee (play), David Magee (screenplay)","Johnny Depp, Kate Winslet, Julie Christie, Radha Mitchell",English,"USA, UK",Won 1 Oscar. Another 20 wins & 77 nominations.,67.0,7.8,"175,603",tt0308644,1,0
Get Shorty,Oct,1995,30.25,72.021008,115.02100800000001,105,30250000.0,7.0,14825,R,0,0,1,1,0,0,0,,1995,R,20 Oct 1995,105 min,"Comedy, Crime, Thriller",Barry Sonnenfeld,"Elmore Leonard (novel), Scott Frank (screenplay)","John Travolta, Gene Hackman, Rene Russo, Danny DeVito",English,USA,Won 1 Golden Globe. Another 5 wins & 15 nominations.,82.0,6.9,"63,443",tt0113161,1,0
We Were Soldiers,Mar,2002,70.0,78.12019599999999,114.65826200000001,143,75000000.0,7.1,14939,R,1,0,0,1,0,0,0,PASS,2002,R,01 Mar 2002,138 min,"Action, Drama, History",Randall Wallace,"Harold G. Moore (book), Joseph L. Galloway (book), Randall Wallace (screenplay)","Mel Gibson, Madeleine Stowe, Greg Kinnear, Sam Elliott","English, Vietnamese, French","USA, Germany",2 wins & 5 nominations.,65.0,7.1,"104,364",tt0277434,1,0
Coyote Ugly,Aug,2000,45.0,60.786269,113.916474,100,45000000.0,5.4,13221,R,0,0,1,1,0,1,0,FAIL,2000,PG-13,04 Aug 2000,100 min,"Comedy, Drama, Music",David McNally,Gina Wendkos,"Piper Perabo, Adam Garcia, John Goodman, Maria Bello",English,USA,4 wins & 4 nominations.,27.0,5.6,"91,192",tt0200550,1,0
Insomnia,May,2002,46.0,67.263182,113.622499,118,46000000.0,7.3,22235,R,0,0,0,1,0,0,0,FAIL,2002,R,24 May 2002,118 min,"Drama, Mystery, Thriller",Christopher Nolan,"Hillary Seitz (screenplay), Nikolaj Frobenius, Erik Skjoldbjærg","Al Pacino, Martin Donovan, Oliver 'Ole' Zemen, Hilary Swank",English,"USA, Canada",1 win & 10 nominations.,78.0,7.2,"222,030",tt0278504,1,0
The Score,Jul,2001,68.0,71.069884,113.54209099999999,124,68000000.0,6.8,16106,R,0,0,0,1,0,0,0,,2001,R,13 Jul 2001,124 min,"Crime, Drama, Thriller",Frank Oz,"Daniel E. Taylor (story), Kario Salem (story), Kario Salem (screenplay), Lem Dobbs (screenplay), Scott Marshall Smith (screenplay)","Robert De Niro, Edward Norton, Marlon Brando, Angela Bassett","English, French","USA, Germany",1 win & 1 nomination.,71.0,6.8,"102,819",tt0227445,1,0
Judge Dredd,Jun,1995,85.0,34.687912,113.48791200000001,96,90000000.0,4.6,9979,R,1,0,0,0,0,0,0,,1995,R,30 Jun 1995,96 min,"Action, Crime, Sci-Fi",Danny Cannon,"John Wagner (characters), Carlos Ezquerra (characters), Michael De Luca (story), William Wisher Jr. (story), William Wisher Jr. (screenplay), Steven E. de Souza (screenplay)","Sylvester Stallone, Armand Assante, Rob Schneider, Jürgen Prochnow",English,USA,2 wins & 5 nominations.,,5.5,"89,351",tt0113492,1,0
Species,Jul,1995,35.0,60.054449,113.354449,108,35000000.0,5.4,8963,R,1,0,0,1,0,0,0,FAIL,1995,R,07 Jul 1995,108 min,"Action, Horror, Sci-Fi",Roger Donaldson,Dennis Feldman,"Ben Kingsley, Michael Madsen, Alfred Molina, Forest Whitaker",English,USA,3 wins & 6 nominations.,,5.8,"61,679",tt0114508,1,0
Final Destination,Mar,2000,23.0,53.302314,112.03687,98,23000000.0,6.6,16504,R,0,0,0,0,0,0,0,FAIL,2000,R,17 Mar 2000,98 min,"Horror, Thriller",James Wong,"Glen Morgan (screenplay), James Wong (screenplay), Jeffrey Reddick (screenplay), Jeffrey Reddick (story)","Devon Sawa, Ali Larter, Kerr Smith, Kristen Cloke","English, French","Canada, USA",3 wins & 3 nominations.,36.0,6.7,"183,769",tt0195714,1,0
Frankenstein,Nov,1994,45.0,22.006296,112.00629599999999,123,45000000.0,6.0,6941,R,0,0,0,1,0,0,0,,1931,NOT RATED,21 Nov 1931,70 min,"Drama, Horror, Sci-Fi",James Whale,"John L. Balderston (based upon the composition by), Mary Shelley (from the novel by), Peggy Webling (adapted from the play by), Garrett Fort (screen play), Francis Edward Faragoh (screen play), Richard Schayer (scenario editor)","Colin Clive, Mae Clarke, John Boles, Boris Karloff","English, Latin",USA,3 wins & 2 nominations.,,8.0,"48,838",tt0021884,1,0
Doctor Zhivago,Dec,1965,11.0,111.721,111.859493,200,11000000.0,7.9,10283,PG-13,0,0,0,1,0,1,0,,1965,PG-13,31 Dec 1965,197 min,"Drama, Romance, War",David Lean,"Boris Pasternak (novel), Robert Bolt (screenplay)","Omar Sharif, Julie Christie, Geraldine Chaplin, Rod Steiger","English, Russian, French","USA, Italy, UK",Won 5 Oscars. Another 16 wins & 13 nominations.,,8.0,"56,439",tt0059113,1,0
The Pianist,Dec,2002,35.0,32.519321999999995,111.85418200000001,150,35000000.0,8.5,30467,R,0,0,0,1,0,0,0,,2002,R,28 Mar 2003,150 min,"Biography, Drama, War",Roman Polanski,"Ronald Harwood (screenplay), Wladyslaw Szpilman (book)","Adrien Brody, Emilia Fox, Michal Zebrowski, Ed Stoppard","English, German, Russian","France, Poland, Germany, UK",Won 3 Oscars. Another 52 wins & 70 nominations.,85.0,8.5,"503,532",tt0253474,1,0
You Only Live Twice,Jun,1967,9.5,43.1,111.6,117,9500000.0,6.8,8252,,1,0,0,0,0,0,0,,1967,APPROVED,13 Jun 1967,117 min,"Action, Adventure, Thriller",Lewis Gilbert,"Harold Jack Bloom (additional story material), Roald Dahl (screenplay)","Sean Connery, Akiko Wakabayashi, Mie Hama, Tetsurô Tanba","English, Japanese, Russian",UK,Nominated for 1 BAFTA Film Award. Another 1 win & 2 nominations.,,6.9,"76,281",tt0062512,1,0
White Chicks,Jun,2004,20.0,69.148997,111.44899699999999,109,,4.8,4782,PG-13,0,0,1,0,0,0,0,PASS,2004,PG-13,23 Jun 2004,109 min,"Comedy, Crime",Keenen Ivory Wayans,"Keenen Ivory Wayans (screenplay), Shawn Wayans (screenplay), Marlon Wayans (screenplay), Andrew McElfresh (screenplay), Michael Anthony Snowden (screenplay), Xavier Cook (screenplay), Keenen Ivory Wayans (story), Shawn Wayans (story), Marlon Wayans (story)","Shawn Wayans, Marlon Wayans, Jaime King, Frankie Faison",English,USA,2 wins & 9 nominations.,41.0,5.4,"100,389",tt0381707,1,0
The Net,Jul,1995,22.0,50.621733,110.52173300000001,114,22000000.0,5.6,12201,PG-13,1,0,0,1,0,0,0,PASS,1995,PG-13,28 Jul 1995,114 min,"Action, Crime, Drama",Irwin Winkler,"John Brancato, Michael Ferris","Sandra Bullock, Jeremy Northam, Dennis Miller, Diane Baker","English, Spanish",USA,2 wins & 1 nomination.,51.0,5.8,"49,252",tt0113957,1,0
Sideways,Oct,2004,17.0,71.502303,109.79319199999999,123,16000000.0,8.0,17051,R,0,0,1,1,0,0,0,PASS,2004,R,21 Jan 2005,126 min,"Comedy, Drama, Romance",Alexander Payne,"Rex Pickett (novel), Alexander Payne (screenplay), Jim Taylor (screenplay)","Paul Giamatti, Thomas Haden Church, Virginia Madsen, Sandra Oh","English, Armenian","USA, Hungary",Won 1 Oscar. Another 120 wins & 82 nominations.,94.0,7.5,"151,734",tt0375063,1,0
Porky's,Mar,1982,4.0,109.492484,109.492484,94,4000000.0,5.4,5483,,0,0,1,0,0,0,0,FAIL,1981,R,19 Mar 1982,94 min,Comedy,Bob Clark,Bob Clark,"Dan Monahan, Mark Herrier, Wyatt Knight, Roger Wilson",English,"Canada, USA",1 win & 1 nomination.,40.0,6.2,"31,551",tt0084522,1,0
Billy Elliot,Oct,2000,5.0,21.995263,109.26713400000001,110,5000000.0,7.7,16725,R,0,0,0,1,0,0,0,PASS,2000,R,10 Nov 2000,110 min,"Drama, Music, Romance",Stephen Daldry,Lee Hall,"Jamie Bell, Jean Heywood, Jamie Draven, Gary Lewis",English,"UK, France",Nominated for 3 Oscars. Another 54 wins & 63 nominations.,74.0,7.7,"99,556",tt0249462,1,0
The Amityville Horror,Apr,2005,18.5,65.233369,109.175673,90,18000000.0,5.8,2945,R,0,0,0,0,0,0,0,PASS,2005,R,15 Apr 2005,90 min,"Drama, Horror, Mystery",Andrew Douglas,"Scott Kosar (screenplay), Jay Anson (novel), Sandor Stern (earlier screenplay), George Lutz (material), Kathy Lutz (material)","Ryan Reynolds, Melissa George, Jesse James, Jimmy Bennett",English,USA,2 wins & 4 nominations.,33.0,6.0,"82,727",tt0384806,1,0
One Flew Over the Cuckoo's Nest,Nov,1975,4.4,108.981275,108.981275,133,4400000.0,8.7,70234,,0,0,0,1,0,0,0,FAIL,1975,R,21 Nov 1975,133 min,Drama,Milos Forman,"Lawrence Hauben (screenplay), Bo Goldman (screenplay), Ken Kesey (based on the novel by), Dale Wasserman (the play version: ""One Flew Over the Cuckoo's Nest"" by)","Michael Berryman, Peter Brocco, Dean R. Brooks, Alonzo Brown",English,USA,Won 5 Oscars. Another 30 wins & 13 nominations.,79.0,8.7,"687,873",tt0073486,1,0
Hidalgo,Mar,2004,78.0,67.286731,108.086731,136,78000000.0,6.6,7328,PG-13,1,0,0,1,0,0,0,,2004,PG-13,05 Mar 2004,136 min,"Action, Adventure, Western",Joe Johnston,John Fusco,"Viggo Mortensen, Zuleikha Robinson, Omar Sharif, Louise Lombard","English, Arabic, Sioux","USA, Morocco",1 win & 2 nominations.,54.0,6.7,"68,228",tt0317648,1,0
The Texas Chainsaw Massacre,Oct,2003,9.0,80.571655,107.96731899999999,98,9200000.0,5.9,9587,R,1,0,0,0,0,0,0,,2003,R,17 Oct 2003,98 min,Horror,Marcus Nispel,"Kim Henkel, Tobe Hooper, Scott Kosar (screenplay)","Jessica Biel, Jonathan Tucker, Erica Leerhsen, Mike Vogel",English,USA,4 wins & 14 nominations.,38.0,6.2,"110,125",tt0324216,1,0
The American President,Nov,1995,62.0,60.022813,107.82281299999998,114,62000000.0,6.9,11834,PG-13,0,0,1,1,0,1,0,PASS,1995,PG-13,17 Nov 1995,114 min,"Comedy, Drama, Romance",Rob Reiner,Aaron Sorkin,"Michael Douglas, Annette Bening, Martin Sheen, Michael J. Fox","English, French",USA,Nominated for 1 Oscar. Another 1 win & 9 nominations.,67.0,6.8,"43,239",tt0112346,1,0
Three Kings,Oct,1999,48.0,60.652035999999995,107.752036,114,48000000.0,7.3,31503,R,1,0,1,1,0,0,0,,1999,R,01 Oct 1999,114 min,"Action, Adventure, Comedy",David O. Russell,"John Ridley (story), David O. Russell (screenplay)","George Clooney, Mark Wahlberg, Ice Cube, Spike Jonze","English, Arabic",USA,8 wins & 19 nominations.,82.0,7.1,"138,366",tt0120188,1,0
Ace Ventura: Pet Detective,Feb,1994,12.0,72.217396,107.217396,86,12000000.0,6.2,20705,PG-13,0,0,1,0,0,0,0,FAIL,1994,PG-13,04 Feb 1994,86 min,Comedy,Tom Shadyac,"Jack Bernstein (story), Jack Bernstein (screenplay), Tom Shadyac (screenplay), Jim Carrey (screenplay)","Jim Carrey, Courteney Cox, Sean Young, Tone Loc",English,USA,5 wins & 4 nominations.,37.0,6.9,"219,802",tt0109040,1,0
The Chronicles of Riddick,Jun,2004,120.0,57.712751000000004,107.212751,135,110000000.0,6.2,11438,PG-13,1,0,0,0,0,0,0,FAIL,2004,PG-13,11 Jun 2004,119 min,"Action, Adventure, Sci-Fi",David Twohy,"Jim Wheat (characters), Ken Wheat (characters), David Twohy","Vin Diesel, Colm Feore, Thandie Newton, Judi Dench",English,USA,4 nominations.,38.0,6.7,"185,333",tt0296572,1,0
Shaft,Jun,2000,53.012938,70.32786800000001,107.19010800000001,99,46000000.0,6.0,13742,R,1,0,0,0,0,0,0,FAIL,2000,R,16 Jun 2000,99 min,"Action, Crime, Thriller",John Singleton,"Ernest Tidyman (novel), John Singleton (story), Shane Salerno (story), Richard Price (screenplay), John Singleton (screenplay), Shane Salerno (screenplay)","Samuel L. Jackson, Vanessa Williams, Jeffrey Wright, Christian Bale","English, German, Spanish","Germany, USA",1 win & 13 nominations.,50.0,5.9,"58,873",tt0162650,1,0
