title,month,year,budget,Domestic Gross($M),Worldwide Gross($M),length,budget,rating,votes,mpaa,action,animation,comedy,drama,documentary,romance,short,bechdel,Year,Rated,Released,Runtime,Genre,Director,Writer,Actors,Language,Country,Awards,Metascore,imdbRating,imdbVotes,imdbID,lame,label
Gosford Park,Dec,2001,18.0,41.300105,41.300105,137,15000000.0,7.3,16831,R,0,0,0,1,0,0,0,PASS,2001,R,18 Jan 2002,131 min,"Drama, Mystery",Robert Altman,"Julian Fellowes, Robert Altman (based upon an idea by), Bob Balaban (based upon an idea by)","Maggie Smith, Michael Gambon, Kristin Scott Thomas, Camilla Rutherford",English,"UK, USA, Italy",Won 1 Oscar. Another 31 wins & 73 nominations.,90.0,7.3,"65,436",tt0280707,1,0
The Mirror Has Two Faces,Nov,1996,42.0,41.267469,41.267469,122,42000000.0,5.7,2775,PG-13,0,0,1,1,0,1,0,PASS,1996,PG-13,15 Nov 1996,126 min,"Comedy, Drama, Romance",Barbra Streisand,"André Cayatte (screenplay), Gérard Oury (screenplay), Richard LaGravenese (screen story), Richard LaGravenese (screenplay)","Barbra Streisand, Jeff Bridges, Lauren Bacall, George Segal",English,USA,Nominated for 2 Oscars. Another 5 wins & 7 nominations.,,6.5,"11,552",tt0117057,1,0
The French Connection,Oct,1971,2.2,41.158757,41.158757,104,1800000.0,7.8,11783,,1,0,0,1,0,0,0,FAIL,1971,R,09 Oct 1971,104 min,"Action, Crime, Drama",William Friedkin,"Ernest Tidyman (screenplay), Robin Moore (based on the book by)","Gene Hackman, Fernando Rey, Roy Scheider, Tony Lo Bianco","English, French",USA,Won 5 Oscars. Another 17 wins & 10 nominations.,96.0,7.8,"83,452",tt0067116,1,0
Money Talks,Aug,1997,25.0,41.076865000000005,41.076865000000005,97,25000000.0,5.5,2720,R,1,0,1,0,0,0,0,,1997,R,22 Aug 1997,97 min,"Action, Comedy, Crime",Brett Ratner,"Joel Cohen, Alec Sokolow","Chris Tucker, Charlie Sheen, Heather Locklear, Elise Neal","English, French",USA,1 nomination.,,6.1,"22,905",tt0119695,1,0
Happy Gilmore,Feb,1996,10.0,38.623459999999994,41.004412,92,10000000.0,6.8,17746,PG-13,0,0,1,0,0,0,0,,1996,PG-13,16 Feb 1996,92 min,"Comedy, Sport",Dennis Dugan,"Tim Herlihy, Adam Sandler","Adam Sandler, Christopher McDonald, Julie Bowen, Frances Bay",English,USA,1 win & 4 nominations.,31.0,7.0,"157,907",tt0116483,1,0
Where the Heart Is,Apr,2000,15.0,33.771174,40.862054,120,15000000.0,6.4,5042,PG-13,0,0,1,1,0,1,0,PASS,2000,PG-13,28 Apr 2000,120 min,"Comedy, Drama, Romance",Matt Williams,"Lowell Ganz (screenplay), Babaloo Mandel (screenplay), Billie Letts (novel)","Natalie Portman, Ashley Judd, Stockard Channing, Joan Cusack",English,USA,1 win & 2 nominations.,30.0,6.8,"27,208",tt0198021,1,0
Undercover Brother,May,2002,25.0,38.230435,40.796145,85,25000000.0,6.0,5138,PG-13,1,0,1,0,0,0,0,,2002,PG-13,31 May 2002,86 min,"Action, Comedy",Malcolm D. Lee,"John Ridley (internet series), John Ridley (story), John Ridley (screenplay), Michael McCullers (screenplay)","Eddie Griffin, Chris Kattan, Denise Richards, Aunjanue Ellis",English,USA,1 win & 7 nominations.,69.0,5.8,"29,769",tt0279493,1,0
Bill & Ted's Excellent Adventure,Feb,1989,10.0,40.485039,40.485039,90,10000000.0,6.6,12277,,0,0,1,0,0,0,0,FAIL,1989,PG,17 Feb 1989,90 min,"Adventure, Comedy, Music",Stephen Herek,"Chris Matheson, Ed Solomon","Keanu Reeves, Alex Winter, George Carlin, Terry Camilleri","English, French, German, Greek,  Ancient (to 1453)",USA,3 nominations.,44.0,6.9,"86,499",tt0096928,1,0
Bill & Ted's Excellent Adventure,Feb,1989,10.0,40.485039,40.485039,90,10000000.0,6.6,12277,,0,0,1,0,0,0,0,FAIL,1989,PG,17 Feb 1989,90 min,"Adventure, Comedy, Music",Stephen Herek,"Chris Matheson, Ed Solomon","Keanu Reeves, Alex Winter, George Carlin, Terry Camilleri","English, French, German, Greek,  Ancient (to 1453)",USA,3 nominations.,44.0,6.9,"86,096",tt0096928,1,0
Bless the Child,Aug,2000,40.0,29.374178000000004,40.435694,107,40000000.0,5.0,3814,R,0,0,0,0,0,0,0,,2000,R,11 Aug 2000,107 min,"Crime, Drama, Horror",Chuck Russell,"Cathy Cash Spellman (novel), Thomas Rickman (screenplay), Clifford Green (screenplay), Ellen Green (screenplay)","Kim Basinger, Jimmy Smits, Holliston Coleman, Rufus Sewell",English,"USA, Germany",1 win & 5 nominations.,17.0,5.1,"12,084",tt0163983,1,0
The Master of Disguise,Aug,2002,16.0,40.36353,40.36353,80,16000000.0,2.9,3903,PG,0,0,1,0,0,0,0,,2002,PG,02 Aug 2002,80 min,"Adventure, Comedy, Family",Perry Andelin Blake,"Dana Carvey, Harris Goldberg","Dana Carvey, Jennifer Esposito, Harold Gould, James Brolin",English,USA,5 nominations.,12.0,3.3,"18,296",tt0295427,1,0
The Faculty,Dec,1998,15.0,40.283321,40.283321,104,15000000.0,6.1,13143,R,0,0,0,0,0,0,0,FAIL,1998,R,25 Dec 1998,104 min,"Horror, Sci-Fi",Robert Rodriguez,"David Wechter (story), Bruce Kimmel (story), Kevin Williamson (screenplay)","Jordana Brewster, Clea DuVall, Laura Harris, Josh Hartnett",English,USA,8 nominations.,61.0,6.4,"92,720",tt0133751,1,0
The Piano,Nov,1993,7.0,40.157856,40.157856,121,7000000.0,7.4,12394,,0,0,0,1,0,1,0,,1993,R,11 Feb 1994,121 min,"Drama, Music, Romance",Jane Campion,Jane Campion,"Holly Hunter, Harvey Keitel, Sam Neill, Anna Paquin","English, British Sign Language, Maori","New Zealand, Australia, France",Won 3 Oscars. Another 56 wins & 42 nominations.,89.0,7.6,"64,498",tt0107822,1,0
I Still Know What You Did Last Summer,Nov,1998,24.0,40.020621999999996,40.020621999999996,100,24000000.0,4.0,9524,R,0,0,0,0,0,0,0,,1998,R,13 Nov 1998,100 min,"Horror, Mystery",Danny Cannon,"Lois Duncan (characters), Trey Callaway","Jennifer Love Hewitt, Freddie Prinze Jr., Brandy Norwood, Mekhi Phifer",English,USA,4 wins & 7 nominations.,21.0,4.6,"55,533",tt0130018,1,0
Caddyshack,Jul,1980,6.0,39.846344,39.846344,98,6000000.0,7.1,13453,,0,0,1,0,0,0,0,,1980,R,25 Jul 1980,98 min,"Comedy, Sport",Harold Ramis,"Brian Doyle-Murray, Harold Ramis, Douglas Kenney","Chevy Chase, Rodney Dangerfield, Ted Knight, Michael O'Keefe",English,USA,1 nomination.,,7.4,"82,745",tt0080487,1,0
Crocodile Dundee in Los Angeles,Apr,2001,25.0,25.590119,39.393111,92,25000000.0,4.7,2698,PG,0,0,1,1,0,0,0,,2001,PG,20 Apr 2001,92 min,"Adventure, Comedy, Crime",Simon Wincer,"Paul Hogan (characters), Matt Berry, Eric Abrams","Paul Hogan, Linda Kozlowski, Jere Burns, Jonathan Banks",English,"Australia, USA",2 nominations.,37.0,4.8,"19,788",tt0231402,1,0
Hocus Pocus,Jul,1993,28.0,39.360490999999996,39.360490999999996,96,28000000.0,5.3,3256,,0,0,1,0,0,0,0,PASS,1993,PG,16 Jul 1993,96 min,"Comedy, Family, Fantasy",Kenny Ortega,"David Kirschner (story), Mick Garris (story), Mick Garris (screenplay), Neil Cuthbert (screenplay)","Bette Midler, Sarah Jessica Parker, Kathy Najimy, Omri Katz",English,USA,2 wins & 9 nominations.,,6.7,"62,936",tt0107120,1,0
Anna and the King,Dec,1999,75.0,39.251128,39.251128,148,75000000.0,6.6,6739,PG-13,0,0,0,1,0,1,0,FAIL,1999,PG-13,17 Dec 1999,148 min,"Drama, History, Romance",Andy Tennant,"Anna Leonowens (diaries), Steve Meerson (screenplay), Peter Krikes (screenplay)","Jodie Foster, Yun-Fat Chow, Bai Ling, Tom Felton","English, Thai, French",USA,Nominated for 2 Oscars. Another 12 nominations.,56.0,6.7,"31,278",tt0166485,1,0
The Legend of Bagger Vance,Nov,2000,60.0,30.695227000000003,39.235486,126,60000000.0,6.4,7123,PG-13,0,0,1,1,0,1,0,,2000,PG-13,03 Nov 2000,126 min,"Drama, Fantasy, Sport",Robert Redford,"Steven Pressfield (novel), Jeremy Leven (screenplay)","Will Smith, Matt Damon, Charlize Theron, Bruce McGill",English,USA,2 wins & 10 nominations.,47.0,6.7,"45,844",tt0146984,1,0
Primary Colors,Mar,1998,65.0,39.017984000000006,39.017984000000006,143,65000000.0,6.8,7756,R,0,0,1,1,0,0,0,PASS,1998,R,20 Mar 1998,143 min,"Comedy, Drama",Mike Nichols,"Joe Klein (novel), Elaine May (screenplay)","John Travolta, Emma Thompson, Billy Bob Thornton, Kathy Bates",English,"France, UK, Germany, USA, Japan",Nominated for 2 Oscars. Another 10 wins & 28 nominations.,70.0,6.7,"24,038",tt0119942,1,0
Yentl,Nov,1983,12.0,39.012240999999996,39.012240999999996,132,12000000.0,5.7,2030,,0,0,1,1,0,1,0,,1983,PG,06 Jan 1984,132 min,"Drama, Musical, Romance",Barbra Streisand,"Jack Rosenthal (screenplay), Barbra Streisand (screenplay), Isaac Bashevis Singer (story ""Yentl,  the Yeshiva Boy"")","Barbra Streisand, Mandy Patinkin, Amy Irving, Nehemiah Persoff",English,"UK, USA",Won 1 Oscar. Another 5 wins & 14 nominations.,,6.6,"9,573",tt0086619,1,0
Clockstoppers,Mar,2002,26.0,36.985501,38.788828,94,26000000.0,5.1,2555,PG,0,0,0,0,0,0,0,,2002,PG,29 Mar 2002,94 min,"Action, Adventure, Comedy",Jonathan Frakes,"Rob Hedden (story), Andy Hedden (story), J. David Stem (story), David N. Weiss (story), Rob Hedden (screenplay), J. David Stem (screenplay), David N. Weiss (screenplay)","Jesse Bradford, French Stewart, Paula Garcés, Michael Biehn",English,USA,,40.0,5.2,"11,295",tt0157472,1,0
Little Shop of Horrors,Dec,1986,30.0,38.747384999999994,38.747384999999994,94,30000000.0,6.4,8911,,0,0,1,0,0,0,0,FAIL,1986,PG-13,19 Dec 1986,94 min,"Comedy, Horror, Musical",Frank Oz,"Howard Ashman (screenplay), Howard Ashman (musical play ""Little Shop of Horrors""), Roger Corman (based on the film by), Charles B. Griffith","Levi Stubbs, Rick Moranis, Ellen Greene, Vincent Gardenia",English,USA,Nominated for 2 Oscars. Another 2 wins & 11 nominations.,81.0,6.9,"49,847",tt0091419,1,0
Urban Legends: Final Cut,Sep,2000,15.0,21.468807,38.574362,97,15000000.0,3.8,3280,R,0,0,0,0,0,0,0,,2000,R,22 Sep 2000,97 min,"Horror, Mystery, Thriller",John Ottman,"Silvio Horta (characters), Paul Harris Boardman, Scott Derrickson","Jennifer Morrison, Matthew Davis, Hart Bochner, Loretta Devine",English,"USA, France",1 win & 1 nomination.,16.0,4.1,"13,062",tt0192731,1,0
The Ghost and the Darkness,Oct,1996,55.0,38.564422,38.564422,109,55000000.0,6.4,8360,R,1,0,0,1,0,0,0,,1996,R,11 Oct 1996,110 min,"Adventure, Drama, Horror",Stephen Hopkins,William Goldman,"Michael Douglas, Val Kilmer, Tom Wilkinson, John Kani","English, Hindi","USA, Germany",Won 1 Oscar. Another 2 nominations.,,6.8,"46,856",tt0116409,1,0
What's the Worst That Could Happen?,Jun,2001,30.0,32.267773999999996,38.462071,97,45000000.0,5.0,2531,PG-13,0,0,1,0,0,0,0,,2001,PG-13,01 Jun 2001,94 min,"Comedy, Crime",Sam Weisman,"Donald E. Westlake (novel), Matthew Chapman (screenplay)","Martin Lawrence, Danny DeVito, John Leguizamo, Glenne Headly","English, American Sign Language",USA,,37.0,5.5,"12,581",tt0161083,1,0
Beauty Shop,Mar,2005,25.0,36.35135,38.35135,104,,4.6,518,PG-13,0,0,1,0,0,0,0,PASS,2005,PG-13,30 Mar 2005,105 min,Comedy,Bille Woodruff,"Elizabeth Hunter (story), Kate Lanier (screenplay), Norman Vance Jr. (screenplay)","Queen Latifah, Alicia Silverstone, Andie MacDowell, Alfre Woodard",English,USA,15 nominations.,53.0,5.5,"13,325",tt0388500,1,0
After the Sunset,Nov,2004,57.0,28.328132,38.329114000000004,97,58000000.0,6.0,3431,PG-13,1,0,1,0,0,0,0,,2004,PG-13,12 Nov 2004,97 min,"Action, Comedy, Crime",Brett Ratner,"Paul Zbyszewski (story), Paul Zbyszewski (screenplay), Craig Rosenberg (screenplay)","Pierce Brosnan, Salma Hayek, Woody Harrelson, Don Cheadle",English,USA,1 nomination.,38.0,6.3,"38,496",tt0367479,1,0
Head of State,Mar,2003,35.2,37.788228000000004,38.283765,95,,5.1,2960,PG-13,0,0,1,0,0,0,0,,2003,PG-13,28 Mar 2003,95 min,Comedy,Chris Rock,"Chris Rock, Ali LeRoi","Chris Rock, Bernie Mac, Dylan Baker, Nick Searcy",English,USA,10 nominations.,44.0,5.4,"15,125",tt0325537,1,0
Annie Hall,Apr,1977,4.0,38.251425,38.251425,93,4000000.0,8.3,21462,,0,0,1,0,0,1,0,PASS,1977,PG,20 Apr 1977,93 min,"Comedy, Romance",Woody Allen,"Woody Allen, Marshall Brickman","Woody Allen, Diane Keaton, Tony Roberts, Carol Kane","English, German",USA,Won 4 Oscars. Another 26 wins & 8 nominations.,,8.1,"195,736",tt0075686,1,0
The Original Kings of Comedy,Aug,2000,3.0,38.168022,38.236338,115,3000000.0,6.1,1386,R,0,0,1,0,1,0,0,,2000,R,18 Aug 2000,115 min,"Comedy, Documentary",Spike Lee,"Cedric the Entertainer, Steve Harvey, D.L. Hughley, Bernie Mac","Steve Harvey, D.L. Hughley, Cedric the Entertainer, Bernie Mac",English,USA,3 nominations.,76.0,6.6,"4,705",tt0236388,1,0
The Running Man,Nov,1987,30.0,38.122,38.122,101,27000000.0,6.2,11847,,1,0,0,0,0,0,0,,1987,R,13 Nov 1987,101 min,"Action, Crime, Sci-Fi",Paul Michael Glaser,"Stephen King (novel), Steven E. de Souza (screenplay)","Arnold Schwarzenegger, Maria Conchita Alonso, Yaphet Kotto, Jim Brown",English,USA,1 win & 3 nominations.,,6.6,"113,820",tt0093894,1,0
Spaceballs,Jun,1987,22.7,38.119483,38.119483,96,22700000.0,6.7,20054,,0,0,1,0,0,0,0,FAIL,1987,PG,24 Jun 1987,96 min,"Adventure, Comedy, Sci-Fi",Mel Brooks,"Mel Brooks, Thomas Meehan, Ronny Graham","Mel Brooks, John Candy, Rick Moranis, Bill Pullman",English,USA,1 win.,46.0,7.1,"138,435",tt0094012,1,0
The Banger Sisters,Sep,2002,10.0,30.306281,38.067218,98,10000000.0,5.6,3189,R,0,0,1,1,0,0,0,PASS,2002,R,20 Sep 2002,98 min,"Comedy, Drama",Bob Dolman,Bob Dolman,"Goldie Hawn, Susan Sarandon, Geoffrey Rush, Erika Christensen",English,USA,Nominated for 1 Golden Globe. Another 1 win.,48.0,5.6,"12,471",tt0280460,1,0
Emma,Aug,1996,5.9,22.231658,37.831658000000004,121,6000000.0,6.9,6431,PG,0,0,1,0,0,1,0,PASS,1996,PG,30 Aug 1996,120 min,"Comedy, Drama, Romance",Douglas McGrath,"Jane Austen (novel), Douglas McGrath (screenplay)","Gwyneth Paltrow, James Cosmo, Greta Scacchi, Alan Cumming",English,"UK, USA",Won 1 Oscar. Another 2 wins & 7 nominations.,66.0,6.8,"28,159",tt0116191,1,0
The Black Stallion,Oct,1979,2.7,37.799642999999996,37.799642999999996,118,2700000.0,7.0,1822,,0,0,0,0,0,0,0,,1979,G,17 Oct 1979,118 min,"Adventure, Family, Sport",Carroll Ballard,"Melissa Mathison (screenplay), Jeanne Rosenberg (screenplay), William D. Wittliff (screenplay), Walter Farley (novel)","Kelly Reno, Mickey Rooney, Teri Garr, Clarence Muse","English, Arabic, Italian",USA,Nominated for 2 Oscars. Another 7 wins & 4 nominations.,84.0,7.4,"8,990",tt0078872,1,0
Showgirls,Sep,1995,40.0,20.350754000000002,37.750754,131,45000000.0,3.8,11483,NC-17,0,0,0,1,0,0,0,PASS,1995,NC-17,22 Sep 1995,128 min,Drama,Paul Verhoeven,Joe Eszterhas,"Elizabeth Berkley, Kyle MacLachlan, Gina Gershon, Glenn Plummer",English,"France, USA",10 wins & 10 nominations.,16.0,4.6,"50,602",tt0114436,1,0
How Stella Got Her Groove Back,Aug,1998,20.0,37.672944,37.672944,124,20000000.0,5.0,1475,R,0,0,0,1,0,1,0,,1998,R,14 Aug 1998,124 min,"Comedy, Drama, Romance",Kevin Rodney Sullivan,"Terry McMillan (novel), Terry McMillan (screenplay), Ronald Bass (screenplay)","Angela Bassett, Taye Diggs, Whoopi Goldberg, Regina King",English,USA,4 wins & 8 nominations.,56.0,5.5,"5,486",tt0120703,1,0
Halloween: Resurrection,Jul,2002,15.0,30.259652000000003,37.659652,89,15000000.0,4.3,4323,R,0,0,0,0,0,0,0,,2002,R,12 Jul 2002,94 min,"Comedy, Horror, Thriller",Rick Rosenthal,"Debra Hill (characters), John Carpenter (characters), Larry Brand (story), Larry Brand (screenplay), Sean Hood (screenplay)","Jamie Lee Curtis, Brad Loree, Busta Rhymes, Bianca Kajlich",English,USA,1 nomination.,19.0,4.1,"27,319",tt0220506,1,0
Tom Jones,Oct,1963,1.0,37.6,37.6,128,1000000.0,7.2,1392,,0,0,1,0,0,1,0,,1963,UNRATED,11 Dec 1963,128 min,"Adventure, Comedy, History",Tony Richardson,"John Osborne (screenplay), Henry Fielding (based on the novel by)","George Devine, Rachel Kempson, Angela Baddeley, Joyce Redman",English,UK,Won 4 Oscars. Another 16 wins & 20 nominations.,,6.7,"8,579",tt0057590,1,0
Oliver!,Dec,1968,10.0,37.402877000000004,37.402877000000004,153,10000000.0,7.3,3310,,0,0,0,1,0,0,0,,1968,G,27 Sep 1968,153 min,"Drama, Family, Musical",Carol Reed,"Lionel Bart (book), Vernon Harris (screenplay), Charles Dickens (freely adapted from ""Oliver Twist"" by)","Ron Moody, Shani Wallis, Oliver Reed, Harry Secombe",English,UK,Won 5 Oscars. Another 7 wins & 25 nominations.,,7.5,"25,638",tt0063385,1,0
Time Bandits,Nov,1981,12.0,37.4,37.4,110,5000000.0,6.9,9434,,0,0,1,0,0,0,0,FAIL,1981,PG,06 Nov 1981,110 min,"Adventure, Comedy, Fantasy",Terry Gilliam,"Michael Palin, Terry Gilliam","John Cleese, Sean Connery, Shelley Duvall, Katherine Helmond",English,UK,1 win & 8 nominations.,,7.0,"46,511",tt0081633,1,0
The Majestic,Dec,2001,72.0,27.796042,37.306334,156,72000000.0,6.7,8649,PG,0,0,0,1,0,1,0,FAIL,2001,PG,21 Dec 2001,152 min,"Drama, Romance",Frank Darabont,Michael Sloane,"Jim Carrey, Bob Balaban, Jeffrey DeMunn, Hal Holbrook",English,USA,3 wins & 1 nomination.,27.0,6.9,"45,198",tt0268995,1,0
Psycho,Dec,1998,20.0,21.541218,37.226217999999996,105,20000000.0,5.0,7255,R,0,0,0,0,0,0,0,,1960,R,08 Sep 1960,109 min,"Horror, Mystery, Thriller",Alfred Hitchcock,"Joseph Stefano (screenplay), Robert Bloch (novel)","Anthony Perkins, Vera Miles, John Gavin, Janet Leigh",English,USA,Nominated for 4 Oscars. Another 5 wins & 9 nominations.,,8.5,"428,898",tt0054215,1,0
Jersey Girl,Mar,2004,35.0,25.266129,37.066129,102,35000000.0,6.4,6853,PG-13,0,0,1,1,0,0,0,,2004,PG-13,26 Mar 2004,102 min,"Comedy, Drama, Romance",Kevin Smith,Kevin Smith,"Betty Aberlin, Matt McFarland, Sarah Stafford, Paulie Litt",English,USA,1 win & 6 nominations.,43.0,6.2,"54,702",tt0300051,1,0
The Bachelor,Nov,1999,21.0,21.731001000000003,36.882378,101,21000000.0,5.0,4183,PG-13,0,0,1,0,0,1,0,,1999,PG-13,05 Nov 1999,101 min,Comedy,Gary Sinyor,"Roi Cooper Megrue (play), Jean C. Havez, Clyde Bruckman, Joseph A. Mitchell, Steve Cohen (screenplay)","Chris O'Donnell, Renée Zellweger, Artie Lange, Edward Asner","English, Spanish",USA,1 win & 1 nomination.,31.0,5.0,"14,778",tt0120596,1,0
My Favorite Martian,Feb,1999,60.0,36.850101,36.850101,93,60000000.0,4.5,1942,PG,0,0,1,0,0,0,0,,1999,PG,12 Feb 1999,94 min,"Comedy, Family, Sci-Fi",Donald Petrie,"John L. Greene (television series My Favorite Martian), Sherri Stoner, Deanna Oliver","Christopher Lloyd, Jeff Daniels, Elizabeth Hurley, Daryl Hannah",English,USA,,,4.9,"10,959",tt0120764,1,0
Kiss of the Dragon,Jul,2001,25.0,36.833473,36.833473,98,25000000.0,6.2,7887,R,1,0,0,1,0,0,0,FAIL,2001,R,06 Jul 2001,98 min,"Action, Crime, Drama",Chris Nahon,"Jet Li (story), Luc Besson (screenplay), Robert Mark Kamen (screenplay)","Jet Li, Bridget Fonda, Tchéky Karyo, Max Ryan","English, French, Mandarin",France,,58.0,6.6,"53,454",tt0271027,1,0
Titan A.E.,Jun,2000,75.0,22.751979000000002,36.751979,94,75000000.0,6.4,9373,PG,1,1,0,0,0,0,0,PASS,2000,PG,16 Jun 2000,94 min,"Animation, Action, Adventure","Don Bluth, Gary Goldman, Art Vitello","Hans Bauer (story), Randall McCormick (story), Ben Edlund (screenplay), John August (screenplay), Joss Whedon (screenplay)","Matt Damon, Bill Pullman, John Leguizamo, Nathan Lane","English, Mandarin",USA,1 win & 7 nominations.,48.0,6.6,"52,537",tt0120913,1,0
"Sex, Lies, and Videotape",Aug,1989,1.2,24.741667,36.741667,100,1200000.0,7.1,7461,,0,0,0,1,0,0,0,FAIL,1989,R,22 Sep 1989,100 min,Drama,Steven Soderbergh,Steven Soderbergh,"James Spader, Andie MacDowell, Peter Gallagher, Laura San Giacomo",English,USA,Nominated for 1 Oscar. Another 14 wins & 20 nominations.,86.0,7.2,"38,165",tt0098724,1,0
Eight Legged Freaks,Jul,2002,30.0,17.266505,36.722311,99,30000000.0,5.5,6362,PG-13,1,0,1,0,0,0,0,,2002,PG-13,17 Jul 2002,99 min,"Action, Comedy, Horror",Ellory Elkayem,"Ellory Elkayem (story), Randy Kornfield (story), Jesse Alexander (screenplay), Ellory Elkayem (screenplay)","David Arquette, Kari Wuhrer, Scott Terra, Scarlett Johansson",English,USA,1 nomination.,53.0,5.4,"43,950",tt0271367,1,0
The Adventures of Pinocchio,Jul,1996,25.0,15.38217,36.68217,92,25000000.0,5.6,577,,0,0,0,0,0,0,0,,1996,G,26 Jul 1996,96 min,"Fantasy, Family, Adventure",Steve Barron,"Sherry Mills (screenplay), Steve Barron (screenplay), Tom Benedek (screenplay), Barry Berman (screenplay), Carlo Collodi (novel)","Martin Landau, Jonathan Taylor Thomas, Geneviève Bujold, Udo Kier","Italian, English","UK, USA, France, Germany, Czech Republic",1 win & 2 nominations.,,5.3,"4,115",tt0115472,1,0
Shine,Nov,1996,5.5,35.811509,36.663895000000004,105,5500000.0,7.6,12425,PG-13,0,0,0,1,0,1,0,,1996,PG-13,14 Feb 1997,105 min,"Biography, Drama, Music",Scott Hicks,"Jan Sardi (screenplay), Scott Hicks (story)","Geoffrey Rush, Justin Braine, Sonia Todd, Chris Haywood","English, Yiddish",Australia,Won 1 Oscar. Another 44 wins & 48 nominations.,87.0,7.7,"43,564",tt0117631,1,0
Hotel Rwanda,Dec,2004,17.5,23.519128,36.521223,121,,8.5,8328,PG-13,0,0,0,1,0,0,0,,2004,PG-13,04 Feb 2005,121 min,"Drama, History, War",Terry George,"Keir Pearson, Terry George","Xolani Mali, Don Cheadle, Desmond Dube, Hakeem Kae-Kazim","English, French","UK, South Africa, Italy",Nominated for 3 Oscars. Another 16 wins & 42 nominations.,79.0,8.1,"267,029",tt0395169,1,0
The Glimmer Man,Oct,1996,45.0,20.404841,36.404841,88,,4.8,2606,R,1,0,0,1,0,0,0,FAIL,1996,R,04 Oct 1996,91 min,"Action, Comedy, Crime",John Gray,Kevin Brodbin,"Steven Seagal, Keenen Ivory Wayans, Bob Gunton, Brian Cox",English,USA,,,5.3,"15,600",tt0116421,1,0
Alive,Jan,1993,32.0,36.29967,36.29967,127,32000000.0,6.7,5786,,1,0,0,1,0,0,0,,1993,R,15 Jan 1993,120 min,"Adventure, Biography, Drama",Frank Marshall,"Piers Paul Read (book), John Patrick Shanley (screenplay)","Ethan Hawke, Vincent Spano, Josh Hamilton, Bruce Ramsay",English,"USA, Canada",Nominated for 1 Primetime Emmy. Another 1 win & 1 nomination.,,7.1,"39,494",tt0106246,1,0
Mad Max Beyond Thunderdome,Jul,1985,10.0,36.230219,36.230219,107,,5.8,8207,,1,0,0,0,0,0,0,,1985,PG-13,10 Jul 1985,107 min,"Action, Adventure, Sci-Fi","George Miller, George Ogilvie","Terry Hayes, George Miller","Mel Gibson, Bruce Spence, Adam Cockburn, Tina Turner",English,Australia,Nominated for 1 Golden Globe. Another 1 win & 7 nominations.,80.0,6.2,"102,571",tt0089530,1,0
Silent Movie,Jun,1976,4.4,36.145695,36.145695,87,4400000.0,6.3,2321,,0,0,1,0,0,0,0,FAIL,1976,PG,16 Jun 1976,87 min,"Comedy, Romance",Mel Brooks,"Mel Brooks (screenplay), Ron Clark (screenplay), Rudy De Luca (screenplay), Barry Levinson (screenplay), Ron Clark (story)","Mel Brooks, Marty Feldman, Dom DeLuise, Sid Caesar",,USA,Nominated for 4 Golden Globes. Another 1 win & 1 nomination.,,6.7,"12,836",tt0075222,1,0
Set It Off,Nov,1996,9.0,36.049108000000004,36.049108000000004,123,9000000.0,6.1,1619,R,1,0,0,1,0,0,0,PASS,1996,R,06 Nov 1996,123 min,"Action, Crime, Drama",F. Gary Gray,"Takashi Bufford (story), Takashi Bufford (screenplay), Kate Lanier (screenplay)","Jada Pinkett Smith, Queen Latifah, Vivica A. Fox, Kimberly Elise",English,USA,5 wins & 5 nominations.,,6.8,"10,292",tt0117603,1,0
Garden State,Jul,2004,2.5,26.782315999999998,36.028802,109,2500000.0,8.1,23814,R,0,0,1,1,0,1,0,PASS,2004,R,20 Aug 2004,102 min,"Comedy, Drama, Romance",Zach Braff,Zach Braff,"Zach Braff, Kenneth Graymez, George C. Wolfe, Austin Lysy","English, Klingon",USA,13 wins & 37 nominations.,67.0,7.6,"188,415",tt0333766,1,0
The Greatest Show on Earth,Jan,1952,4.0,36.0,36.0,152,4000000.0,6.7,1361,,0,0,0,1,0,1,0,,1952,NOT RATED,01 May 1952,152 min,"Drama, Family, Romance",Cecil B. DeMille,"Fredric M. Frank (screenplay), Barré Lyndon (screenplay), Theodore St. John (screenplay), Fredric M. Frank (story), Theodore St. John (story), Frank Cavett (story)","Betty Hutton, Cornel Wilde, Charlton Heston, Dorothy Lamour","English, Russian",USA,Won 2 Oscars. Another 4 wins & 5 nominations.,,6.7,"9,592",tt0044672,1,0
The Robe,Sep,1953,5.0,36.0,36.0,135,5000000.0,6.6,1074,,0,0,0,1,0,0,0,,1953,UNRATED,04 Dec 1953,135 min,"Drama, History",Henry Koster,"Philip Dunne (screenplay), Gina Kaus (adaptation), Lloyd C. Douglas (novel), Albert Maltz (screenplay)","Richard Burton, Jean Simmons, Victor Mature, Michael Rennie",English,USA,Won 2 Oscars. Another 3 wins & 4 nominations.,,6.8,"6,387",tt0046247,1,0
What a Girl Wants,Apr,2003,25.0,35.990505,35.990505,105,20000000.0,5.7,3533,PG,0,0,1,1,0,1,0,,2003,PG,04 Apr 2003,105 min,"Comedy, Drama, Family",Dennie Gordon,"William Douglas-Home (play), William Douglas-Home, Jenny Bicks (screenplay), Elizabeth Chandler (screenplay)","Amanda Bynes, Colin Firth, Kelly Preston, Eileen Atkins",English,USA,1 win.,41.0,5.8,"48,496",tt0286788,1,0
Taps,Dec,1981,14.0,35.856053,35.856053,126,,6.4,2568,,0,0,0,1,0,0,0,,1981,PG,25 Dec 1981,126 min,Drama,Harold Becker,"Darryl Ponicsan (screenplay), Robert Mark Kamen (screenplay), James Lineberger (adaptation), Devery Freeman (novel)","George C. Scott, Timothy Hutton, Ronny Cox, Sean Penn",English,USA,,,6.7,"13,163",tt0083169,1,0
The Black Hole,Dec,1979,20.0,35.841901,35.841901,98,18500000.0,5.4,3425,,0,0,0,0,0,0,0,,1979,PG,21 Dec 1979,98 min,"Action, Sci-Fi",Gary Nelson,"Jeb Rosebrook (story), Bob Barbash (story), Richard H. Landau (story), Jeb Rosebrook (screenplay), Gerry Day (screenplay)","Maximilian Schell, Anthony Perkins, Robert Forster, Joseph Bottoms",English,USA,Nominated for 2 Oscars. Another 6 nominations.,,5.9,"18,590",tt0078869,1,0
My Dog Skip,Jan,2000,7.0,34.09964,35.795319,95,7000000.0,7.1,3109,PG,0,0,0,1,0,0,0,,2000,PG,03 Mar 2000,95 min,"Drama, Family, Sport",Jay Russell,"Willie Morris (book), Gail Gilchriest (screenplay)","Frankie Muniz, Diane Lane, Luke Wilson, Kevin Bacon","English, German",USA,7 wins & 4 nominations.,61.0,7.0,"16,771",tt0156812,1,0
The Indian in the Cupboard,Jul,1995,45.0,35.627221999999996,35.627221999999996,96,45000000.0,5.8,1430,PG,0,0,0,0,0,0,0,,1995,PG,14 Jul 1995,96 min,"Drama, Family, Fantasy",Frank Oz,"Lynne Reid Banks (novel), Melissa Mathison (screenplay)","Hal Scardino, Litefoot, Lindsay Crouse, Richard Jenkins",English,USA,1 win & 6 nominations.,,5.9,"20,985",tt0113419,1,0
Selena,Mar,1997,20.0,35.450113,35.450113,127,20000000.0,6.1,2870,PG,0,0,0,1,0,0,0,PASS,1997,PG,21 Mar 1997,127 min,"Biography, Drama, Music",Gregory Nava,Gregory Nava,"Jennifer Lopez, Jackie Guerra, Constance Marie, Alex Meneses","English, Spanish",USA,Nominated for 1 Golden Globe. Another 8 wins & 5 nominations.,65.0,6.7,"19,298",tt0120094,1,0
